DEVICE ID 8087:07dc on Bus 003 Address 005 =================
 bLength                :   0x12 (18 bytes)
 bDescriptorType        :    0x1 Device
 bcdUSB                 :  0x200 USB 2.0
 bDeviceClass           :   0xe0 Wireless Controller
 bDeviceSubClass        :    0x1
 bDeviceProtocol        :    0x1
 bMaxPacketSize0        :   0x40 (64 bytes)
 idVendor               : 0x8087
 idProduct              : 0x07dc
 bcdDevice              :    0x1 Device 0.01
 iManufacturer          :    0x0 
 iProduct               :    0x0 
 iSerialNumber          :    0x0 
 bNumConfigurations     :    0x1
  CONFIGURATION 1: 100 mA ==================================
   bLength              :    0x9 (9 bytes)
   bDescriptorType      :    0x2 Configuration
   wTotalLength         :   0xb1 (177 bytes)
   bNumInterfaces       :    0x2
   bConfigurationValue  :    0x1
   iConfiguration       :    0x0 
   bmAttributes         :   0xe0 Self Powered, Remote Wakeup
   bMaxPower            :   0x32 (100 mA)
    INTERFACE 0: Wireless Controller =======================
     bLength            :    0x9 (9 bytes)
     bDescriptorType    :    0x4 Interface
     bInterfaceNumber   :    0x0
     bAlternateSetting  :    0x0
     bNumEndpoints      :    0x3
     bInterfaceClass    :   0xe0 Wireless Controller
     bInterfaceSubClass :    0x1
     bInterfaceProtocol :    0x1
     iInterface         :    0x0 
      ENDPOINT 0x81: Interrupt IN ==========================
       bLength          :    0x7 (7 bytes)
       bDescriptorType  :    0x5 Endpoint
       bEndpointAddress :   0x81 IN
       bmAttributes     :    0x3 Interrupt
       wMaxPacketSize   :   0x40 (64 bytes)
       bInterval        :    0x1
      ENDPOINT 0x2: Bulk OUT ===============================
       bLength          :    0x7 (7 bytes)
       bDescriptorType  :    0x5 Endpoint
       bEndpointAddress :    0x2 OUT
       bmAttributes     :    0x2 Bulk
       wMaxPacketSize   :   0x40 (64 bytes)
       bInterval        :    0x1
      ENDPOINT 0x82: Bulk IN ===============================
       bLength          :    0x7 (7 bytes)
       bDescriptorType  :    0x5 Endpoint
       bEndpointAddress :   0x82 IN
       bmAttributes     :    0x2 Bulk
       wMaxPacketSize   :   0x40 (64 bytes)
       bInterval        :    0x1
    INTERFACE 1: Wireless Controller =======================
     bLength            :    0x9 (9 bytes)
     bDescriptorType    :    0x4 Interface
     bInterfaceNumber   :    0x1
     bAlternateSetting  :    0x0
     bNumEndpoints      :    0x2
     bInterfaceClass    :   0xe0 Wireless Controller
     bInterfaceSubClass :    0x1
     bInterfaceProtocol :    0x1
     iInterface         :    0x0 
      ENDPOINT 0x3: Isochronous OUT ========================
       bLength          :    0x7 (7 bytes)
       bDescriptorType  :    0x5 Endpoint
       bEndpointAddress :    0x3 OUT
       bmAttributes     :    0x1 Isochronous
       wMaxPacketSize   :    0x0 (0 bytes)
       bInterval        :    0x1
      ENDPOINT 0x83: Isochronous IN ========================
       bLength          :    0x7 (7 bytes)
       bDescriptorType  :    0x5 Endpoint
       bEndpointAddress :   0x83 IN
       bmAttributes     :    0x1 Isochronous
       wMaxPacketSize   :    0x0 (0 bytes)
       bInterval        :    0x1
    INTERFACE 1, 1: Wireless Controller ====================
     bLength            :    0x9 (9 bytes)
     bDescriptorType    :    0x4 Interface
     bInterfaceNumber   :    0x1
     bAlternateSetting  :    0x1
     bNumEndpoints      :    0x2
     bInterfaceClass    :   0xe0 Wireless Controller
     bInterfaceSubClass :    0x1
     bInterfaceProtocol :    0x1
     iInterface         :    0x0 
      ENDPOINT 0x3: Isochronous OUT ========================
       bLength          :    0x7 (7 bytes)
       bDescriptorType  :    0x5 Endpoint
       bEndpointAddress :    0x3 OUT
       bmAttributes     :    0x1 Isochronous
       wMaxPacketSize   :    0x9 (9 bytes)
       bInterval        :    0x1
      ENDPOINT 0x83: Isochronous IN ========================
       bLength          :    0x7 (7 bytes)
       bDescriptorType  :    0x5 Endpoint
       bEndpointAddress :   0x83 IN
       bmAttributes     :    0x1 Isochronous
       wMaxPacketSize   :    0x9 (9 bytes)
       bInterval        :    0x1
    INTERFACE 1, 2: Wireless Controller ====================
     bLength            :    0x9 (9 bytes)
     bDescriptorType    :    0x4 Interface
     bInterfaceNumber   :    0x1
     bAlternateSetting  :    0x2
     bNumEndpoints      :    0x2
     bInterfaceClass    :   0xe0 Wireless Controller
     bInterfaceSubClass :    0x1
     bInterfaceProtocol :    0x1
     iInterface         :    0x0 
      ENDPOINT 0x3: Isochronous OUT ========================
       bLength          :    0x7 (7 bytes)
       bDescriptorType  :    0x5 Endpoint
       bEndpointAddress :    0x3 OUT
       bmAttributes     :    0x1 Isochronous
       wMaxPacketSize   :   0x11 (17 bytes)
       bInterval        :    0x1
      ENDPOINT 0x83: Isochronous IN ========================
       bLength          :    0x7 (7 bytes)
       bDescriptorType  :    0x5 Endpoint
       bEndpointAddress :   0x83 IN
       bmAttributes     :    0x1 Isochronous
       wMaxPacketSize   :   0x11 (17 bytes)
       bInterval        :    0x1
    INTERFACE 1, 3: Wireless Controller ====================
     bLength            :    0x9 (9 bytes)
     bDescriptorType    :    0x4 Interface
     bInterfaceNumber   :    0x1
     bAlternateSetting  :    0x3
     bNumEndpoints      :    0x2
     bInterfaceClass    :   0xe0 Wireless Controller
     bInterfaceSubClass :    0x1
     bInterfaceProtocol :    0x1
     iInterface         :    0x0 
      ENDPOINT 0x3: Isochronous OUT ========================
       bLength          :    0x7 (7 bytes)
       bDescriptorType  :    0x5 Endpoint
       bEndpointAddress :    0x3 OUT
       bmAttributes     :    0x1 Isochronous
       wMaxPacketSize   :   0x19 (25 bytes)
       bInterval        :    0x1
      ENDPOINT 0x83: Isochronous IN ========================
       bLength          :    0x7 (7 bytes)
       bDescriptorType  :    0x5 Endpoint
       bEndpointAddress :   0x83 IN
       bmAttributes     :    0x1 Isochronous
       wMaxPacketSize   :   0x19 (25 bytes)
       bInterval        :    0x1
    INTERFACE 1, 4: Wireless Controller ====================
     bLength            :    0x9 (9 bytes)
     bDescriptorType    :    0x4 Interface
     bInterfaceNumber   :    0x1
     bAlternateSetting  :    0x4
     bNumEndpoints      :    0x2
     bInterfaceClass    :   0xe0 Wireless Controller
     bInterfaceSubClass :    0x1
     bInterfaceProtocol :    0x1
     iInterface         :    0x0 
      ENDPOINT 0x3: Isochronous OUT ========================
       bLength          :    0x7 (7 bytes)
       bDescriptorType  :    0x5 Endpoint
       bEndpointAddress :    0x3 OUT
       bmAttributes     :    0x1 Isochronous
       wMaxPacketSize   :   0x21 (33 bytes)
       bInterval        :    0x1
      ENDPOINT 0x83: Isochronous IN ========================
       bLength          :    0x7 (7 bytes)
       bDescriptorType  :    0x5 Endpoint
       bEndpointAddress :   0x83 IN
       bmAttributes     :    0x1 Isochronous
       wMaxPacketSize   :   0x21 (33 bytes)
       bInterval        :    0x1
    INTERFACE 1, 5: Wireless Controller ====================
     bLength            :    0x9 (9 bytes)
     bDescriptorType    :    0x4 Interface
     bInterfaceNumber   :    0x1
     bAlternateSetting  :    0x5
     bNumEndpoints      :    0x2
     bInterfaceClass    :   0xe0 Wireless Controller
     bInterfaceSubClass :    0x1
     bInterfaceProtocol :    0x1
     iInterface         :    0x0 
      ENDPOINT 0x3: Isochronous OUT ========================
       bLength          :    0x7 (7 bytes)
       bDescriptorType  :    0x5 Endpoint
       bEndpointAddress :    0x3 OUT
       bmAttributes     :    0x1 Isochronous
       wMaxPacketSize   :   0x31 (49 bytes)
       bInterval        :    0x1
      ENDPOINT 0x83: Isochronous IN ========================
       bLength          :    0x7 (7 bytes)
       bDescriptorType  :    0x5 Endpoint
       bEndpointAddress :   0x83 IN
       bmAttributes     :    0x1 Isochronous
       wMaxPacketSize   :   0x31 (49 bytes)
       bInterval        :    0x1


DEVICE ID 0403:faf0 on Bus 003 Address 010 =================
 bLength                :   0x12 (18 bytes)
 bDescriptorType        :    0x1 Device
 bcdUSB                 :  0x200 USB 2.0
 bDeviceClass           :    0x0 Specified at interface
 bDeviceSubClass        :    0x0
 bDeviceProtocol        :    0x0
 bMaxPacketSize0        :    0x8 (8 bytes)
 idVendor               : 0x0403
 idProduct              : 0xfaf0
 bcdDevice              : 0x1000 Device 16.0
 iManufacturer          :    0x1 FTDI
 iProduct               :    0x2 Kinesis K-Cube  DC Driver
 iSerialNumber          :    0x3 27504112
 bNumConfigurations     :    0x1
  CONFIGURATION 1: 0 mA ====================================
   bLength              :    0x9 (9 bytes)
   bDescriptorType      :    0x2 Configuration
   wTotalLength         :   0x20 (32 bytes)
   bNumInterfaces       :    0x1
   bConfigurationValue  :    0x1
   iConfiguration       :    0x0 
   bmAttributes         :   0xc0 Self Powered
   bMaxPower            :    0x0 (0 mA)
    INTERFACE 0: Vendor Specific ===========================
     bLength            :    0x9 (9 bytes)
     bDescriptorType    :    0x4 Interface
     bInterfaceNumber   :    0x0
     bAlternateSetting  :    0x0
     bNumEndpoints      :    0x2
     bInterfaceClass    :   0xff Vendor Specific
     bInterfaceSubClass :   0xff
     bInterfaceProtocol :   0xff
     iInterface         :    0x2 Kinesis K-Cube  DC Driver
      ENDPOINT 0x81: Bulk IN ===============================
       bLength          :    0x7 (7 bytes)
       bDescriptorType  :    0x5 Endpoint
       bEndpointAddress :   0x81 IN
       bmAttributes     :    0x2 Bulk
       wMaxPacketSize   :   0x40 (64 bytes)
       bInterval        :    0x0
      ENDPOINT 0x2: Bulk OUT ===============================
       bLength          :    0x7 (7 bytes)
       bDescriptorType  :    0x5 Endpoint
       bEndpointAddress :    0x2 OUT
       bmAttributes     :    0x2 Bulk
       wMaxPacketSize   :   0x40 (64 bytes)
       bInterval        :    0x0
       
       
DEVICE ID 5986:0295 on Bus 003 Address 004 =================
 bLength                :   0x12 (18 bytes)
 bDescriptorType        :    0x1 Device
 bcdUSB                 :  0x200 USB 2.0
 bDeviceClass           :   0xef Miscellaneous
 bDeviceSubClass        :    0x2
 bDeviceProtocol        :    0x1
 bMaxPacketSize0        :   0x40 (64 bytes)
 idVendor               : 0x5986
 idProduct              : 0x0295
 bcdDevice              : 0x1466 Device 20.66
 iManufacturer          :    0x1 Error Accessing String
 iProduct               :    0x2 Error Accessing String
 iSerialNumber          :    0x0 
 bNumConfigurations     :    0x1
  CONFIGURATION 1: 256 mA ==================================
   bLength              :    0x9 (9 bytes)
   bDescriptorType      :    0x2 Configuration
   wTotalLength         :  0x28f (655 bytes)
   bNumInterfaces       :    0x2
   bConfigurationValue  :    0x1
   iConfiguration       :    0x0 
   bmAttributes         :   0x80 Bus Powered
   bMaxPower            :   0x80 (256 mA)
    INTERFACE 0: Video =====================================
     bLength            :    0x9 (9 bytes)
     bDescriptorType    :    0x4 Interface
     bInterfaceNumber   :    0x0
     bAlternateSetting  :    0x0
     bNumEndpoints      :    0x1
     bInterfaceClass    :    0xe Video
     bInterfaceSubClass :    0x1
     bInterfaceProtocol :    0x0
     iInterface         :    0x2 Error Accessing String
      ENDPOINT 0x81: Interrupt IN ==========================
       bLength          :    0x7 (7 bytes)
       bDescriptorType  :    0x5 Endpoint
       bEndpointAddress :   0x81 IN
       bmAttributes     :    0x3 Interrupt
       wMaxPacketSize   :   0x10 (16 bytes)
       bInterval        :    0x5
    INTERFACE 1: Video =====================================
     bLength            :    0x9 (9 bytes)
     bDescriptorType    :    0x4 Interface
     bInterfaceNumber   :    0x1
     bAlternateSetting  :    0x0
     bNumEndpoints      :    0x0
     bInterfaceClass    :    0xe Video
     bInterfaceSubClass :    0x2
     bInterfaceProtocol :    0x0
     iInterface         :    0x0 
    INTERFACE 1, 1: Video ==================================
     bLength            :    0x9 (9 bytes)
     bDescriptorType    :    0x4 Interface
     bInterfaceNumber   :    0x1
     bAlternateSetting  :    0x1
     bNumEndpoints      :    0x1
     bInterfaceClass    :    0xe Video
     bInterfaceSubClass :    0x2
     bInterfaceProtocol :    0x0
     iInterface         :    0x0 
      ENDPOINT 0x82: Isochronous IN ========================
       bLength          :    0x7 (7 bytes)
       bDescriptorType  :    0x5 Endpoint
       bEndpointAddress :   0x82 IN
       bmAttributes     :    0x5 Isochronous
       wMaxPacketSize   :   0x80 (128 bytes)
       bInterval        :    0x1
    INTERFACE 1, 2: Video ==================================
     bLength            :    0x9 (9 bytes)
     bDescriptorType    :    0x4 Interface
     bInterfaceNumber   :    0x1
     bAlternateSetting  :    0x2
     bNumEndpoints      :    0x1
     bInterfaceClass    :    0xe Video
     bInterfaceSubClass :    0x2
     bInterfaceProtocol :    0x0
     iInterface         :    0x0 
      ENDPOINT 0x82: Isochronous IN ========================
       bLength          :    0x7 (7 bytes)
       bDescriptorType  :    0x5 Endpoint
       bEndpointAddress :   0x82 IN
       bmAttributes     :    0x5 Isochronous
       wMaxPacketSize   :  0x200 (512 bytes)
       bInterval        :    0x1
    INTERFACE 1, 3: Video ==================================
     bLength            :    0x9 (9 bytes)
     bDescriptorType    :    0x4 Interface
     bInterfaceNumber   :    0x1
     bAlternateSetting  :    0x3
     bNumEndpoints      :    0x1
     bInterfaceClass    :    0xe Video
     bInterfaceSubClass :    0x2
     bInterfaceProtocol :    0x0
     iInterface         :    0x0 
      ENDPOINT 0x82: Isochronous IN ========================
       bLength          :    0x7 (7 bytes)
       bDescriptorType  :    0x5 Endpoint
       bEndpointAddress :   0x82 IN
       bmAttributes     :    0x5 Isochronous
       wMaxPacketSize   :  0x400 (1024 bytes)
       bInterval        :    0x1
    INTERFACE 1, 4: Video ==================================
     bLength            :    0x9 (9 bytes)
     bDescriptorType    :    0x4 Interface
     bInterfaceNumber   :    0x1
     bAlternateSetting  :    0x4
     bNumEndpoints      :    0x1
     bInterfaceClass    :    0xe Video
     bInterfaceSubClass :    0x2
     bInterfaceProtocol :    0x0
     iInterface         :    0x0 
      ENDPOINT 0x82: Isochronous IN ========================
       bLength          :    0x7 (7 bytes)
       bDescriptorType  :    0x5 Endpoint
       bEndpointAddress :   0x82 IN
       bmAttributes     :    0x5 Isochronous
       wMaxPacketSize   :  0xb00 (2816 bytes)
       bInterval        :    0x1
    INTERFACE 1, 5: Video ==================================
     bLength            :    0x9 (9 bytes)
     bDescriptorType    :    0x4 Interface
     bInterfaceNumber   :    0x1
     bAlternateSetting  :    0x5
     bNumEndpoints      :    0x1
     bInterfaceClass    :    0xe Video
     bInterfaceSubClass :    0x2
     bInterfaceProtocol :    0x0
     iInterface         :    0x0 
      ENDPOINT 0x82: Isochronous IN ========================
       bLength          :    0x7 (7 bytes)
       bDescriptorType  :    0x5 Endpoint
       bEndpointAddress :   0x82 IN
       bmAttributes     :    0x5 Isochronous
       wMaxPacketSize   :  0xc00 (3072 bytes)
       bInterval        :    0x1
    INTERFACE 1, 6: Video ==================================
     bLength            :    0x9 (9 bytes)
     bDescriptorType    :    0x4 Interface
     bInterfaceNumber   :    0x1
     bAlternateSetting  :    0x6
     bNumEndpoints      :    0x1
     bInterfaceClass    :    0xe Video
     bInterfaceSubClass :    0x2
     bInterfaceProtocol :    0x0
     iInterface         :    0x0 
      ENDPOINT 0x82: Isochronous IN ========================
       bLength          :    0x7 (7 bytes)
       bDescriptorType  :    0x5 Endpoint
       bEndpointAddress :   0x82 IN
       bmAttributes     :    0x5 Isochronous
       wMaxPacketSize   : 0x1380 (4992 bytes)
       bInterval        :    0x1
    INTERFACE 1, 7: Video ==================================
     bLength            :    0x9 (9 bytes)
     bDescriptorType    :    0x4 Interface
     bInterfaceNumber   :    0x1
     bAlternateSetting  :    0x7
     bNumEndpoints      :    0x1
     bInterfaceClass    :    0xe Video
     bInterfaceSubClass :    0x2
     bInterfaceProtocol :    0x0
     iInterface         :    0x0 
      ENDPOINT 0x82: Isochronous IN ========================
       bLength          :    0x7 (7 bytes)
       bDescriptorType  :    0x5 Endpoint
       bEndpointAddress :   0x82 IN
       bmAttributes     :    0x5 Isochronous
       wMaxPacketSize   : 0x1400 (5120 bytes)
       bInterval        :    0x1
       
       
DEVICE ID 058f:6366 on Bus 003 Address 003 =================
 bLength                :   0x12 (18 bytes)
 bDescriptorType        :    0x1 Device
 bcdUSB                 :  0x201 USB 2.01
 bDeviceClass           :    0x0 Specified at interface
 bDeviceSubClass        :    0x0
 bDeviceProtocol        :    0x0
 bMaxPacketSize0        :   0x40 (64 bytes)
 idVendor               : 0x058f
 idProduct              : 0x6366
 bcdDevice              :  0x100 Device 1.0
 iManufacturer          :    0x1 Error Accessing String
 iProduct               :    0x2 Error Accessing String
 iSerialNumber          :    0x3 Error Accessing String
 bNumConfigurations     :    0x1
  CONFIGURATION 1: 100 mA ==================================
   bLength              :    0x9 (9 bytes)
   bDescriptorType      :    0x2 Configuration
   wTotalLength         :   0x20 (32 bytes)
   bNumInterfaces       :    0x1
   bConfigurationValue  :    0x1
   iConfiguration       :    0x0 
   bmAttributes         :   0xa0 Bus Powered, Remote Wakeup
   bMaxPower            :   0x32 (100 mA)
    INTERFACE 0: Mass Storage ==============================
     bLength            :    0x9 (9 bytes)
     bDescriptorType    :    0x4 Interface
     bInterfaceNumber   :    0x0
     bAlternateSetting  :    0x0
     bNumEndpoints      :    0x2
     bInterfaceClass    :    0x8 Mass Storage
     bInterfaceSubClass :    0x6
     bInterfaceProtocol :   0x50
     iInterface         :    0x0 
      ENDPOINT 0x1: Bulk OUT ===============================
       bLength          :    0x7 (7 bytes)
       bDescriptorType  :    0x5 Endpoint
       bEndpointAddress :    0x1 OUT
       bmAttributes     :    0x2 Bulk
       wMaxPacketSize   :  0x200 (512 bytes)
       bInterval        :    0x0
      ENDPOINT 0x82: Bulk IN ===============================
       bLength          :    0x7 (7 bytes)
       bDescriptorType  :    0x5 Endpoint
       bEndpointAddress :   0x82 IN
       bmAttributes     :    0x2 Bulk
       wMaxPacketSize   :  0x200 (512 bytes)
       bInterval        :    0x0
       
       
DEVICE ID 1ea7:0064 on Bus 003 Address 002 =================
 bLength                :   0x12 (18 bytes)
 bDescriptorType        :    0x1 Device
 bcdUSB                 :  0x110 USB 1.1
 bDeviceClass           :    0x0 Specified at interface
 bDeviceSubClass        :    0x0
 bDeviceProtocol        :    0x0
 bMaxPacketSize0        :    0x8 (8 bytes)
 idVendor               : 0x1ea7
 idProduct              : 0x0064
 bcdDevice              :  0x200 Device 2.0
 iManufacturer          :    0x0 
 iProduct               :    0x1 Error Accessing String
 iSerialNumber          :    0x0 
 bNumConfigurations     :    0x1
  CONFIGURATION 1: 100 mA ==================================
   bLength              :    0x9 (9 bytes)
   bDescriptorType      :    0x2 Configuration
   wTotalLength         :   0x22 (34 bytes)
   bNumInterfaces       :    0x1
   bConfigurationValue  :    0x1
   iConfiguration       :    0x0 
   bmAttributes         :   0xa0 Bus Powered, Remote Wakeup
   bMaxPower            :   0x32 (100 mA)
    INTERFACE 0: Human Interface Device ====================
     bLength            :    0x9 (9 bytes)
     bDescriptorType    :    0x4 Interface
     bInterfaceNumber   :    0x0
     bAlternateSetting  :    0x0
     bNumEndpoints      :    0x1
     bInterfaceClass    :    0x3 Human Interface Device
     bInterfaceSubClass :    0x1
     bInterfaceProtocol :    0x2
     iInterface         :    0x0 
      ENDPOINT 0x81: Interrupt IN ==========================
       bLength          :    0x7 (7 bytes)
       bDescriptorType  :    0x5 Endpoint
       bEndpointAddress :   0x81 IN
       bmAttributes     :    0x3 Interrupt
       wMaxPacketSize   :    0x8 (8 bytes)
       bInterval        :    0x2
